{
  "id": "the-drowned-conjuror",
  "type": "interactive",
  "tags": ["tomes", "lore"],
  "title": "The Drowned Conjuror",
  "weight": 4,
  "once": true,
  "trigger": { "gte": ["lore", 35] },
  "intro": "Apprentices sorting the salvage bring you a water-swollen tome, giggling and uneasy. It is the account of Maelor, who in the last bright age tried to raise a drowned city whole from the seabed — towers, gardens, ten thousand souls — in a single working. The final pages are written in a shaking hand: he could summon the towers, then only the gardens, then only a single drowned bell, and at the last could not recall the word for 'up'.",
  "advisors": [
    { "cast": { "most": "wisdom" }, "text": "He did not fail because he was weak, Archon. He failed because the memory was going out from under him mid-working. Read it as a warning: the further we reach, the further we have to fall." },
    { "cast": { "trait": { "boldness": "high" } }, "text": "A city from the sea! Give me the mana and I'd finish what Maelor started. He simply ran out of Flame — we haven't yet." }
  ],
  "choices": [
    {
      "id": "study",
      "label": "Set the apprentices to copy and study the tome",
      "win": {
        "text": "You have the tome copied twice against loss, and its lesson read aloud in the hall: great workings die not from too little power but from too little memory. The coven is wiser, and a little more afraid.",
        "effects": [{ "add": ["lore", 10] }, { "add": ["mana", -4] }, { "set_flag": "read_a_failure_tale" }]
      }
    },
    {
      "id": "shelve",
      "label": "Shelve it — the coven needs hope, not omens",
      "win": {
        "text": "You lock Maelor's drowned city away where the apprentices won't brood on it. Some mornings a keeper needs to believe the reaching still works.",
        "effects": [{ "add": ["faith", 4] }, { "add": ["lore", 2] }]
      }
    }
  ]
}
